[
  {
    "id": "patriarchal_horizon",
    "label_ru": "Праотцы (литературный горизонт)",
    "order": 1,
    "year_start": null,
    "year_end": null,
    "span_note_ru": "Нарратив; не абсолютная хронология",
    "confidence": "literary",
    "anchors": ["Авраам", "Иаков", "Иосиф (как фигуры предания)"],
    "date_basis_ru": "Предание/сага в учебном консенсусе, не attested biography",
    "josephus_role": "none"
  },
  {
    "id": "exodus_emergence",
    "label_ru": "Исход и появление Израиля",
    "order": 2,
    "year_start": -1300,
    "year_end": -1000,
    "span_note_ru": "Ок. XIII–XI вв. до н.э. (вилка)",
    "confidence": "disputed",
    "anchors": ["Стела Мернептаха (~1208)", "Поселения Iron I", "«Исход» как память/традиция"],
    "date_basis_ru": "Эпиграфика + археология поселений; массовый исход — disputed",
    "josephus_role": "none"
  },
  {
    "id": "early_monarchy",
    "label_ru": "Ранняя монархия",
    "order": 3,
    "year_start": -1050,
    "year_end": -930,
    "span_note_ru": "Ок. XI–X вв. до н.э. (масштаб спорный)",
    "confidence": "disputed",
    "anchors": ["Саул / Давид / Соломон как традиция", "Тель Дан (byt dwd)"],
    "date_basis_ru": "Надпись Тель Дан; размер «империи» — disputed",
    "josephus_role": "none"
  },
  {
    "id": "divided_kingdoms",
    "label_ru": "Разделённые царства",
    "order": 4,
    "year_start": -930,
    "year_end": -722,
    "span_note_ru": "Ок. 930–722 до н.э.",
    "confidence": "anchored",
    "anchors": ["Израиль и Иудея", "Омриды", "Синхронизмы с Ассирией"],
    "date_basis_ru": "Ассирийские анналы + библейские цари (калибровка)",
    "josephus_role": "none"
  },
  {
    "id": "assyria_to_exile",
    "label_ru": "Ассирия → падение Иудеи",
    "order": 5,
    "year_start": -722,
    "year_end": -586,
    "span_note_ru": "722–586 до н.э.",
    "confidence": "firm",
    "anchors": ["Падение Самарии (722)", "Синаххериб (701)", "597 / 586"],
    "date_basis_ru": "Неоассирийская / неовавилонская хроника",
    "josephus_role": "none"
  },
  {
    "id": "exile_and_persian",
    "label_ru": "Изгнание и персидский Йехуд",
    "order": 6,
    "year_start": -586,
    "year_end": -332,
    "span_note_ru": "586–332 до н.э.",
    "confidence": "firm",
    "anchors": ["Вавилон", "Кир (539)", "Второй храм (~516)", "Эзра / Неемия (проблема источников)"],
    "date_basis_ru": "Вавилонские/персидские синхронизмы; внутренние даты книг — осторожно",
    "josephus_role": "none"
  },
  {
    "id": "hellenistic_hasmonean",
    "label_ru": "Эллинизм и Хасмонеи",
    "order": 7,
    "year_start": -332,
    "year_end": -63,
    "span_note_ru": "332–63 до н.э.",
    "confidence": "firm",
    "anchors": ["Александр", "Селевкиды", "Маккавейский кризис (167–164)", "Хасмонеи"],
    "date_basis_ru": "Эллинистическая хронология; 1–2 Macc как historical documents",
    "josephus_role": "background"
  },
  {
    "id": "roman_herodian",
    "label_ru": "Рим и Ирод",
    "order": 8,
    "year_start": -63,
    "year_end": 30,
    "span_note_ru": "63 до н.э. – ок. 30 н.э.",
    "confidence": "firm",
    "anchors": ["Помпей (63)", "Ирод Великий", "Префекты / прокураторы", "Пилат"],
    "date_basis_ru": "Римская хронология + Иосиф (точечно)",
    "josephus_role": "primary"
  },
  {
    "id": "jesus_jerusalem",
    "label_ru": "Иисус и иерусалимская община",
    "order": 9,
    "year_start": 30,
    "year_end": 40,
    "span_note_ru": "Ок. 30–40 н.э.",
    "confidence": "anchored",
    "anchors": ["Исторический Иисус (ядро)", "Распятие при Пилате", "Ранняя община в Иерусалиме"],
    "date_basis_ru": "Консенсус ~30–33; Павел как ранний контроль; Иосиф — точечно",
    "josephus_role": "point"
  },
  {
    "id": "pauline_networks",
    "label_ru": "Павел и сеть общин",
    "order": 10,
    "year_start": 40,
    "year_end": 65,
    "span_note_ru": "Ок. 40–65 н.э.",
    "confidence": "anchored",
    "anchors": ["Неоспоримые письма Павла", "Антиохия – Коринф – Рим", "Деяния — вторичный нарратив"],
    "date_basis_ru": "Внутренние данные писем + римский контекст",
    "josephus_role": "background"
  },
  {
    "id": "war_and_divergence",
    "label_ru": "Война и расхождение путей",
    "order": 11,
    "year_start": 66,
    "year_end": 70,
    "span_note_ru": "66–70 н.э.",
    "confidence": "firm",
    "anchors": ["Иудейская война", "Разрушение Храма (70)", "Начало расхождения иудаизм / христианство"],
    "date_basis_ru": "Римская история + Иосиф (Война)",
    "josephus_role": "primary"
  },
  {
    "id": "bar_kokhba",
    "label_ru": "Восстание Бар-Кохбы",
    "order": 12,
    "year_start": 132,
    "year_end": 135,
    "span_note_ru": "132–135 н.э.",
    "confidence": "firm",
    "anchors": ["Шимон бар Косба", "Монеты / письма Иудеи", "Адриан", "Элия Капитолина"],
    "date_basis_ru": "Эпиграфика + Дион Кассий",
    "josephus_role": "none"
  }
]
